subject,content,answer,sentence,cat,maincat,subcat,a_perspective_1,a_perspective_2,a_perspective_3,s_perspective_1
why am i having lowerback pain and numbness after 2 c-sections almost 14 years later?,i don't understand why i am having lower back pain and numbness in my lowerback. i know some of the pain is from my epdurial i have with both of my kids by c-sections? but why am i haivng numbness too??? its only in my lower back where i had the epdurials,I don't think the pain and numbness is related to the c sections. It has been so long ago. I think you need to have your symptoms evaluated by a physician.  Good luck,I think you need to have your symptoms evaluated by a physician.,Pain & Pain Management,Health,General Health Care,,,,suggestion
I am TERRIFIED of going to the dentist....?,Is there any medication that will relax me enough to even make an appointment...Valium doesn't work for me,"YES!!

I have the same terrifing fear!  Once I hit the chair I'm in tears and constantly flinch when anyone comes near me.  I loathe the dentist!!!

My dentist is very, very sweet and gentle.  He also gave me a script for Ativan, which really seems to help.  Sadly,initally I had to take a huge dose, which left me helpless for at least two days, but as  the treatments go on, my does goes down.  I also found that listening to music through headsets help a great deal as well.

Keep in mind, Ativan is addictive, be very careful.  Talk to your dentist first!  When you make the appointment, explain that you have a very serious fear, which is beyond the typical ""I hate the dentist"" fear.  If the dentist/office is worth their salt, they will work with you.  If not, find another  dentist.

Gas typically isn't used in most offices anymore, as it's found to cause birth defects in people that are around it for extended periods of time.

Best of luck!","Gas typically isn't used in most offices anymore, as it's found to cause birth defects in people that are around it for extended periods of time.",Dental,Health,Dental,,,,information
What is the best method (or product) to regrow hair and overcome baldness?,"I am approaching 35, eventhough people tell me I look young for my age, I am gradually starting to lose my hair!

I know there are alot of products out there.  Some work and some don't.  Which products or methods seem to work best?

Thanks","In my opinion, the best way to maintain your hair good, and stop them from falling off, is to put high concentrated olive oil on your hair every night you go to bed, and shower your hair with a  NORMAL shampoo (e.g. Head & Shoulders, Pert Plus, or Pantene) in the morning. This herbal way of making your hair stronger can help you in long-term hair wellness. Therefore, try this method and do it on a regular basis, it'll be very helpful.","Head & Shoulders, Pert Plus, or Pantene) in the morning.",Men's Health,Health,Men's Health,,,,treatment
What type of headache do I have? And why am I getting it?,"I have a headache that is killing me, it's right on the top of my head. It doesn't last long, but it comes often. The weirdest thing about it is, I NEVER get headaches, but for the past couple weeks I've been getting them very often and I don't know why. Nothing has changed in my life, I'm not going through any real stress and I'm eating the same and everything, I just don't get it.",I listed a website below that should answer all your questions on headaches. I hope it helps you out. I've also listed a second website that will help you out just in case you have to go to the doctor for this headache that you keep having. Good luck and I hope you start feeling better.,I listed a website below that should answer all your questions on headaches.,Other - Health,Health,Other - Health,,,,suggestion
Peroxide sinus washes - medical professionals only please?,"No layman opinions please - need professional advice.

I have suffered for many years with chronic sinus and ear infections and am plagued with food and environmental allergies. I have read that diluted hydrogen peroxide is good to prevent and help treat sinus infections. Is this true?

Will it damage sinus tissues or anything else? Is it effective and would you recommend it to your patients?","GOOD GOD! You just brought tears to my eyes by reading that!!!

I'm no professional but have dealt with those issues. It's a saline solution you want to use.",It's a saline solution you want to use.,Other - Diseases,Health,Diseases & Conditions,,,,treatment
Why is that you experience less lubrication during sex after giving birth? Its been a year now.?,,It took me almost 5 years to get back to normal.My doctor said it was part Hormones part lack of sex drive.Try Astroglide the stuff works wonders.Also if you are using the pill or shot it can make you dry.,Also if you are using the pill or shot it can make you dry.,Women's Health,Health,Women's Health,,,,cause
"Is seven 10mg ambien too much, if sleep is hard to reach?","I am having difficulty going to sleep, one Ambien is not working. Is 6 or seven okay?","Don't take drugs to sleep. Check out (http://www.reducingstress.net/ )there is a lot of great content and information on the subject there.
Also the stresseraser is a great product for helping you sleep, you can find it at (http://www.buystresseraser.com ) It woks for me, you should really check it out.",Check out (http://www.reducingstress.net/ )there is a lot of great content and information on the subject there.,First Aid,Health,General Health Care,,,,suggestion
Skipped period and having cramps?,I have skipped my period for 2 months and I have never been late like this. I took 3 pregnancy tests and all turned out negative...well I am starting to have really bad cramps...they were mild for about a week and last night they woke me up and all i could do was curl up in a ball. I have a dr app in 2 weeks but I dont know if I can wait that long... Does anyone know whats happening?,You should probably go to the E-room... I have never had this happen but it could be something real big.,You should probably go to the E-room...,Women's Health,Health,Women's Health,,,,suggestion
crash-dieting..bulimia/anorexia??,is it really that bad to be bulimic or anorexic..i've been both n at first i was really skinny and now i started to eat regularly again & i'm average..what are the dangers of crash dieting?,Very dangers for you.  If you are anorexic and bulimic than you most likely will not know when enough is enough.  If you really won't to lose Waite than get to a Doctor and let him help you.,Very dangers for you.,Diet & Fitness,Health,Diet & Fitness,,,,information
I am looking for an ointment you can put under your nose to eliminate odor?,"Its an ointment you can use when doing smelly jobs, almost like vicks but specifically for this.","From riding horses for many years, we use Vic's Vapo Rub under a stud horses nose to ruin the smell of a female horse who is in heat.
If it works for that smell, it should work for most anything else.","From riding horses for many years, we use Vic's Vapo Rub under a stud horses nose to ruin the smell of a female horse who is in heat.",First Aid,Health,General Health Care,treatment,information,,experience
Costal chondritis?,has anyone ever had this? how did you treat it? how long did it last?,"I've had it for over 30 years.Exertion and stress are two things that can aggrevate it.I've been on several pain meds(vicadin,percocet,ketorolac,morphine)but so far none have worked..See your doctor and follow his/her advice.",I've had it for over 30 years.,Injuries,Health,General Health Care,,,,experience
does anybody with a big heart who wants to help our marriage...?,"helo im from the philippines,24 yrs old,married and we been trying to have a baby for five years now.i can feel that my husband is losing hope and i am so scared if time will come that he will leave me because of this.i need your help.can anybody help me treat my infertility???i have irregular menstruation.if anybody outhere who wants to help us avail treatments for infertility...it will really be a great help to save our marriage.please email me...God bless you for having such a big heart.",all the best,all the best,Women's Health,Health,Women's Health,,,,information
"How does ""No Masturbation At All"" effects a man?",,When you get with a woman..you will blow it waaaay too early..and she will be mad she got naked for it.,you will blow it waaaay too early..,Men's Health,Health,Men's Health,,,,information
why does female masturbation via the clitoris hurt the vagina?,,"are you pressing too hard on it?? 
it shouldn't hurt...most women like to have their clitoris touched.",it shouldn't hurt...,Women's Health,Health,Women's Health,,,,information
WEight loss before major surgery?,I need to lose 25 lbs. before surgery.Do you have any info that hospitals use for this?Thanks,"Did your doctor tell you this? If so, ask him to recommend the best way for you to do it. Or, if you know which hospital you will be going to, check with them. 
I hope all goes well, and your surgery is successful.","If so, ask him to recommend the best way for you to do it.",Diet & Fitness,Health,Diet & Fitness,,,,suggestion
i                   i have not had a period in about 3 months or any sex so what could be wrong?,,it can be caused by stress or probably because your diet has gone throw a roller coaster therefore i think thats why,it can be caused by stress or probably because your diet has gone throw a roller coaster therefore i think thats why,Women's Health,Health,Women's Health,,,,cause
I have scholiosis (sp). Should I be taller than I am?,,No I thought it made u shorter. I don't know much so don't listen to me ;),No I thought it made u shorter.,Other - Health,Health,Other - Health,,,,information
eggy-bad tasting and smelling burps Followed by severe vomiting  ANYONE KNOW??,I have had eggy-bad tasting and smelling burps. Followed by severe vomiting. My GI has no idea whats wrong nor does my family Dr. anyone have this and why do i have it?..,Acid reflex?,Acid reflex?,Alternative Medicine,Health,Alternative Medicine,,,,cause
what is narcissitic persoanlity disorder?,,"At least 5 of the following are needed to be diagnosed with Narcissistic Personality Disorder:

1. Has a grandoise sense of self-importance.
2. Is preoccupied with fantasies of unlimited success, power, brilliance, beauty, or ideal love.
3. Believes that he or she is ""special"" and unique and can only be understood by other special people.
4. Requires excessive admiration.
6. Takes advantage of others to achieve his or her own ends.
7. Lacks empathy.
8. Is often envious or believes others are envious of him/her.
9. Arrogant effect.

Some Narcissistic traits are a common and normal developmental stage.  When these traits are compounded by a failure of the interpersonal environment and continue into adulthood they may intensify to the point where NPD is diagnosed.

Narcissism is a psychological disorder resulting from a person's belief that he or she is flawed in a way that makes the person fundamentally unacceptable to others.  

To find out more about this disorder type in your search bar "" Narcissistic Personality Disorder"" and research the many sites.
Good Luck!",3,Mental Health,Health,Mental Health,,,,information
What do black spots on the lungs mean??,"recently my brother in law has been coughing, he was diagnosed with Bronchitus......and then his doctor told him he had some black spots on his xray........does this mean cancer or could it just be infection?","cancer is possible....it happened to my mom, and she wasn't a smoker either",cancer is possible....,Respiratory Diseases,Health,Diseases & Conditions,,,,cause
listing of license filipino dentist?,,do u also wanna know how dos he pull out teeth,do u also wanna know how dos he pull out teeth,Dental,Health,Dental,,,,information
"I have a undiaignosed chronic inflammatory disease, with steroids,my SED rate has dropped,w/ meds,?what if it?","medicines in use crestor,trental,predisone,singular,zyrtec-d,Xopenex HFA,Benydrl,Neurotin,Rhinocort,Lasix
What diseases are controlled by steriods?","Steriods are used for so many things because it is a miracle drug that temporarily fixes many iflamation problems.
I am currently on neurotin, prednisone and quite a few other drugs. I have been diagnosed with Churg-Strauss Syndrome. A very rare condition that has to do with nerve damage and inflammatory problems. They are wanting me to take a drug called Cytoxen starting tomorrow and I am nervous about that. Good luck!",I have been diagnosed with Churg-Strauss Syndrome.,Other - Diseases,Health,Diseases & Conditions,,,,experience
I know I want to try acupuncture. Why should I talk to my primary health care professional first?,,"Simple.  Some insurance plans will cover acupuncture treatments, but only if you are referred to an acupuncturist by your primary health care professional.  It works the same way as referral to any other specialist.","Some insurance plans will cover acupuncture treatments, but only if you are referred to an acupuncturist by your primary health care professional.",Other - Health,Health,Other - Health,,,,information
Wrinkled Fingers when swimming?,Why do your fingers (and toes) always wrinkled up when in the water for long periods?,"Your skin is too soft and there is a layer between your bones and skin whick absorbs water when you are in water. When the layer has absorbed enough water, it starts to send out the excess water to the skin. As the skin is too soft to contain water, it creates wrinkles in your skin and your wrinkles can hold water.

If you were in the water for a very long time, you would see cuts in your skin. This is because, when the wrinkles cannot hold the rest of the water, they cut portions of your skin and let the water flow out again.

BYE",BYE,Injuries,Health,Health & Well-Being,,,,information
Why Do I Keep Getting Nose Warts?,"Every so often, I get a few really big warts or wart-type things on my nose.  I tend to blow my nose a lot all year round because of allergies.  I'm currently following a treatment for these allergies, but in the meantime, I keep blowing my nose.  And these warts keep appearing. 

I've tried to leave it alone.  When I do that, it doesn't disappear completely, and traces are left.  One of the recent ones I got, I went to my doctor who popped it.  I have one now, and tried to pop it.  But there wasn't really anything to pop.  I mean, nothing came out.  It seems just like a circular growth on my nose.

How do I prevent getting these things and what can I do to keep them away?  Thanks.",Warts are caused by the human papilloma virus. Any local chemist should be able to recommend a treatment.,Any local chemist should be able to recommend a treatment.,First Aid,Health,General Health Care,,,,information
Can you get cancer in ur vagina and if so what are the signs? Thanls for the help.?,,There is cervical cancer and ovarian cancer. Every woman should have a pap smear done every year which is a screening for cancer.,Every woman should have a pap smear done every year which is a screening for cancer.,Women's Health,Health,Women's Health,,,,information
"I have occasional odor, itching, sweating, and discharge; what besides a Yeast Infection could this be?",,It could also be a bacterial infection.  Go to the doctor!,Go to the doctor!,Women's Health,Health,Women's Health,,,,suggestion
what is the medicine for premature ejaculation?,,Advil and a hooker.,Advil and a hooker.,Men's Health,Health,Men's Health,,,,treatment
I have a torn meniscus and fluid on my knee.  Should I have surgery?,"Of course I can't fully bend my knee yet.  This injury happend about a month ago.  At times my knee aches, but majority of the time it feels great.  I don't know if this surgery is neccesary.  My doctor insists I should, but at this point in time I believe it might get better.  Any advice would be greatly appreciated.  Thanks.",You should have an MRI of your knee to make sure you don't have torn ligaments. The arthroscopic surgery is very low risk. The benefits definitely outway the risks. Do it!!,The benefits definitely outway the risks.,Injuries,Health,General Health Care,,,,information
im after loseing a couple of pounds before i go on holiday in february?,"im thinking of using the core secrets gym ball by gunner peterson and was wondering if its any good to use 
ive seen the ad on sky tv and it looks good but you know sometimes them tv advertisments are a sham and they dont work im not over weight but i want to get down to eight stone dose anyone have any advice please help","I would like to lose at least 5-6 kg but it's very difficult because I like eating. My aunt has lost 16 kg in some months because she has started going to the gym, she goes three times a week and she comes home late, she doesn't want to cook and so she only eats a yogurt or a cup of milk with biscuits. But my father doesn't want me to do this, and so I'm still fat and I have never had a boyfriend. I'm 1.60 m tall (5.2 ft) and my weight is more or less 140-143 pounds. I know my father behaves like this because I'm his only daughter, but I'm 21 years old and I don't want to become a spinster! If he makes me become a spinster, I would never forgive him! How can I lose 5-6 kilos without starving?",I would like to lose at least 5-6 kg but it's very difficult because I like eating.,Diet & Fitness,Health,Diet & Fitness,,,,experience
whats a jelly thing that comes from a woman vigina?,"its white stuff,smelly","If it is white and smelly, it is most likely some type of infection. It could be a yeast infection, which is easily treated with over the counter creams (Monistat, etc.) Yeast infections are not usually accompanied by a foul odor, though. It sounds like something that would require antibiotics, which your GYN would have to prescribe. 
There is a gel-like discharge that happens at the time of ovulation. It is usually clear and sort of stringy. If that is what you have, it would be happening around 14 days after your period starts.","It sounds like something that would require antibiotics, which your GYN would have to prescribe.",Women's Health,Health,Women's Health,,,,information
"I've been taking Nexium for 1.5 years. It works great,I used to get heartburn from alot of foods,should I stop","Besides (maybe) getting heartburn again, are there any other side eefects when you stop taking Nexium?","I would give stopping a try. I myself have very bad throat problems and have been on Nexium for a few years. I'm not a doctor, but this works for me. I take it 3 months on and three months off. It keeps my throat from bleeding, which is what happens because the acid is so strong it actually eats through the lining in my esophagus. I still get heartburn when I'm not taking it but I just use Tums Chewables during that time and it really works. I guess with me though, it's not the heartburn that really kills me, it's the cut up throat and bleeding. 

I think you should always try to do without the meds if you can. There's nothing worse than living your life a slave to pharmaceuticals if you don't have to. So, at least give it a try. If you can't live without them, then at least you know.",I myself have very bad throat problems and have been on Nexium for a few years.,Pain & Pain Management,Health,General Health Care,,,,experience
I have what I think is a cold but what is bothering me the most is my itchy throat.?,My throat started out soar so I have been using chloraseptic losenges along with sucrets but nothing is helping the itching. any suggestions???,"That itchy throat that goes with a cold is generally caused by post-nasal drip (when the mucus drip down the back of your throat instead of through your nose).

Gargling with salt water (1/2 tsp per cup) often helps.  Taking an antihistamine with decongestant will also help because it will help stop the post-nasal drip.  

If you develop a fever, go see a doctor.",That itchy throat that goes with a cold is generally caused by post-nasal drip (when the mucus drip down the back of your throat instead of through your nose).,Other - Health,Health,Other - Health,,,,cause
What treatment is there for gout?,,I have gout my self. My Doc put me on a pill called Allopurinol.It reduces the uric acid build up which causes these little crystals build up in the joints. I been takeing them for @ 7 years now and had no problems with gout. All so eating some shell fish will cause it to. Might have to change your diet.Good luck,It reduces the uric acid build up which causes these little crystals build up in the joints.,Other - Diseases,Health,Diseases & Conditions,,,,information
i get ankle sprained.. can u help me?,i just want to know how to recover.. because i haven't recover it's 'bout 3 month! oh... please help me..,"Rest, Ice, Compress, And Elevate.
If it's been 3 months and it hasn't gotten better, you need to go to the doctor. You need to make it stronger, try and write the abc's with your foot, that's a good exercise.","You need to make it stronger, try and write the abc's with your foot, that's a good exercise.",Injuries,Health,General Health Care,,,,treatment
Why do i spend my evry day with eye pain from muscles having been removed and cannabis is the only help.?,"in 1972 due to an eye accident my eye was split open and my eye experienced trauma. two muscles were removed . my eye was split open hanging by a ""thread"". now as predicted by doctors then my eye pain will increase. i have not been able to work in my true field for over a decade and largely have taken labourer jobs. i receive or have i asked for help from the governments such as SSI or anything free. the pain has gotten extreme 24/7 and cowardly eye doctors offer no help and say, ""the pain is something you must live with"". this, even though cannabis will  take the pain away and actually my right eye is able to focus. why is cannabis still illegal and would Olive Garden take the SleezEA to court if Oregano were to be made illegal? how much would a bag of Parsely cost? i still live in a ""non-MM"" state. why does the bush lie about being respectful of human dignity, this morning in his press report, when people still continue to suffer from pain in not having the tools to live on?","You have incompetent doctors.  You have damaged nerves that need to be removed and either they don't know that, or they are afraid to take the risks involved to do anything about it.

Just curious - Why would you see being stoned 24/7 as an appropriate alternative to your pain? I believe that the Pot removes your pain, but is that any way to live?","I believe that the Pot removes your pain, but is that any way to live?",Alternative Medicine,Health,Alternative Medicine,,,,information
"I have severe jaw pain, what works for relief?","I had a jaw dislocation a couple of months ago (b/c of TMJ) along with an arthrocentesis procedure. Now my jaw has been very painful for the past few weeks and it's getting worse. Advil doesn't seem to help and to top it all off, I'm supposed to get my wisdom teeth removed soon...all four!",Try eating soft foods for a few days and avoid sleeping positions that might put any pressure on your jaw. Don't ever chew gum or crunch ice or hard candy. This is your excuse to eat only a fillet mignon when you indulge in a steak dinner. Hopefully the wisdom teeth removal will help.,This is your excuse to eat only a fillet mignon when you indulge in a steak dinner.,Pain & Pain Management,Health,General Health Care,,,,information
Anyone know if Splenda/Equal causes tooth decay like regular sugar?,Since they're not real sugar do they cause cavities like regular sugar would?,"I'm a dentist.

There is no way someone's ""friend"" could do a ""science project"" studying whether or not sugar substitutes cause tooth decay....unless of course this ""friend"" had an entire lab with support staff and thousands of dollars worth of equipment.

Modern dental researchers use rats in carefully controlled environments.  They test for the effects of various materials on rats' teeth by sacrificing the rats and examining the teeth under electron microscopes...among other techniques.  It's not some high school science project like seeing which soil makes plants grow faster.

The answer to your question is ""no"".

These sweeteners, as far as I know, cannot be metabolized by the bacteria that cause tooth decay.

Tooth decay is caused by bacterial metabolism producing lactic acid as a waste product.  This lactic acid is what lowers the pH at the surface of your tooth and causes breakdown of the tooth structure.  If the bacteria residing on your teeth are not provided with food they can metabolize, then they cannot produce lactic acid and thus, cannot cause tooth decay.","If the bacteria residing on your teeth are not provided with food they can metabolize, then they cannot produce lactic acid and thus, cannot cause tooth decay.",Dental,Health,Dental,,,,information
Anyone else get embarrassed when?,"Does anyone else get embarrassed when they go to the dentist and the dentist finds cavities in their teeth? I always get really embarrassed, especially if it's more than one cavity. And once, I didn't go to the dentist for a while and when I finally did go it was because I had a really bad toothache - the tooth was TOTALLY rotten and the dentist seemed shocked at how bad it was.......I was SO embarrassed that time (he also found another 3 or 4 cavities!).

But why do we get embarrassed about it? I mean I don't get embarrassed if I have to go to the doctor when I'm sick, and it's kind of the same thing! But I just feel really embarrassed when the dentist says I have cavities!",I HAVE NEVER BEEN EMBARRASSED,I HAVE NEVER BEEN EMBARRASSED,First Aid,Health,General Health Care,,,,experience
