subject,content,answer,sentence,cat,maincat,subcat,a_perspective_1,a_perspective_2,a_perspective_3,s_perspective_1
"My   twin   brother  , is  62  lbs   and  is    5""10"",  can  he  get  gastric  bypass?",,"Hi,  I have been a personal trainer and a bodybuilder for 25 years.  I have trained professional athletes in Major League Baseball, the National Hockey League, Canada National Downhill Ski Team as well as numerous bodybuilders.  I have also helped many 100s of people lose weight, tone up and get into great shape again.  I just had one client lose 95 lbs. I have developed an excellent, easy to follow diet & exercise plan that will help you achieve your goals. I can offer my plan to you for only $20.00 US. Cash or money orders only please.  And I am David Price, 2177  6th Avenue, Trail, BC, Canada, V1R3B8.

Please include your age, whether you are male or female, height, bodyweight and your goals.

I will also offer you free consultation via messenger or e-mail to help you along to achieve your goals.  I look for ward to hearing from you.  Take care.

Sincerely,

David Price",David Price,Diet & Fitness,Health,Diet & Fitness,,,,information
What are The risks of using a tampon?,,"TSS- Toxic Shock Syndrome, it can be a fatal illness, it is rare but does happen to people. It can happen to anyone, even men as it is't just through using tampons. To help prevent getting TSS you can use natural tampons rarther than the branded ones. Alot of tampons contain toxicins and bleaches which effect your body in bad ways. Natural ones contain none of these substances. Theres also cup you can use instead of tampons & sanitary Towels. Other than that if you switch between tampons and towels during your period it will reduce the chances of getting it. If you read the instructions inside a packet of tampons it will explain all of this on there. hope this helped.
P,S don't let it put you off using them altogether,remember this is a very rare illness but just keep it in mind 
xxx","TSS- Toxic Shock Syndrome, it can be a fatal illness, it is rare but does happen to people.",Women's Health,Health,Women's Health,,,,information
do staph infections cause migranes?,,"Migraines are the monster headaches that are simply vessels in your brain and brain area constricting. A staph infection will not cause this to happen. A staph infection COULD cause a sinus headache if the bacteria get into your sinus cavities. The best avenue would be for you to consult your doctor or medical practitioner. He/she will either prescribe antibiotic medication or a homeopathic script that will heal the infection and will heal the sinus area. If you want to help this for now until you see your doctor, try drinking the following: 1/4 teaspoon thyme in a cup of boiling water. Let the thyme steep for 10 minutes. Add 1 teaspoon of lemon juice and sweeten to taste, if you wish. The thyme tea will kill bacteria and will loosen sinus congestion and phlegm/mucus. You could also drink a hot bowl of soup with 1/2 teaspoon of garlic powder and a dash of cayenne pepper. This will also kill bacteria and loosen mucus. Good luck, dear!","If you want to help this for now until you see your doctor, try drinking the following: 1/4 teaspoon thyme in a cup of boiling water.",Skin Conditions,Health,Diseases & Conditions,,,,treatment
Cystic Fibrosis?,Why do people with Cystic Fiborosis need more calories than normal health people?,"Sorry, i Don't get it","Sorry, i Don't get it",Respiratory Diseases,Health,Diseases & Conditions,,,,information
What is the best macronutrient for primary fuel for the human body?,"For example, saturated fats or carbohydrates and why?
If we overeat in either they are still converted to fat in the body, so which is best in moderation?",eggs,eggs,Diet & Fitness,Health,Diet & Fitness,,,,information
under active thyroid?,i seem to loose a lot of hair on a daily basis .Is it anything to do with my under active thyroid or some thing different? i am on mediaction for my thyroid.,"i have low thyroid. if you have low thyroid...here's a great question to answer: can you see the floor of your house? that was what was asked of me at one point, and to my amazement, the answer was no!
anyway, the signs are:fatigue and lack of energy. Women suffering from underactive thyroid experience heavier menstrual periods. Sluggishness and forgetfulness are symptoms of underactive thyroid problem. Other symptoms of this thyroid disorder are dry skin and hair and constipation.
if you have high thyroid, or an overactive one, the signs are:increased body metabolism. This is followed by weight loss and excessive warmth and sweating. Persons suffering from overactive thyroid experience trembling hands, irritability and rapid heartbeat or palpitations. Women with overactive thyroid or hyperthyroidism may experience shorter or lighter menstrual periods.
I take medication, and sadly will have to take 1 pill everyday for the rest of my life. there's a blood check that they will do to see if you have low or high. i hope i've helped you!!",Sluggishness and forgetfulness are symptoms of underactive thyroid problem.,Women's Health,Health,Women's Health,,,,information
Why does it hurt so much wen ur having ur wisdom tooth???,Its like u can't eat anything and i'm getting more skinny...,I myself had to get mine took out so did others i know in my family.The reason could be that there may not be room and they are crowding your other teeth or they could be growing in the wrong way if there is not room.(one of mine was partly under another tooth and growing in sideways.The best thing to do would go get x-rays from your dentist. It didnt hurt at all when they cut mine out!(I was put to sleep)GOOD LUCK!,(I was put to sleep)GOOD LUCK!,Dental,Health,Dental,,,,experience
Is there a cure for HIV?,"I heard from a friend there was a cure for HIV that the government had, and they was holding on to it for population control reasons. I was trying to find out if this is true.","No there is not cure for HIV, there are drugs that you can take that can help you live with HIV but they are expensive and cause several side effects.  Thats an urban myth that the government has a cure.","No there is not cure for HIV, there are drugs that you can take that can help you live with HIV but they are expensive and cause several side effects.",STDs,Health,Diseases & Conditions,,,,information
Medical Question - serious?,I have a nipple that seems to leak although it never feels wet or leaves wet spots but it does seem to eat holes through my clothes around that nipple.  The doctors are running tests but haven't came up with any answers yet.  Anyone ever heard of this?,"different chemicals in your body could affect different bodily functions,seeking medical advice is definately your best answer","different chemicals in your body could affect different bodily functions, seeking medical advice is definately your best answer",Women's Health,Health,Women's Health,,,,suggestion
What's on Seal's Face?,Is it a disease?,"""The dark, horizontal scars on Seal's face are not, as many people have imagined, some kind of tribal marking. They just appeared eight years ago for no apparent reason and no one knows what they are. Seal used to fancy that they were some kind of spiritual inheritance from his forefathers and with the light shining down on his huge frame, reflecting off the surface of his dark, shaven head, they do look striking, adding to his already considerable presence. When Seal moves to the front of the stage, you, the audience, feel as though he's standing among you.""",They just appeared eight years ago for no apparent reason and no one knows what they are.,Skin Conditions,Health,Diseases & Conditions,,,,information
strep/tonsilitis?,"hello friends, what is the max length of time that strep and or tonsilitis should be gone while on antibiotics..  can anyone get a throat abcess while on penicillin or still have bacteria forming? i have had this darn strep/tonsilitis for weeks now, been on amoxil and now penicillin VK, still have redness on each side of my throat with the blisters...its getting better but not where i want it..why is it taking so long?  the pain when swallowing is a little better too...thanks for your answers..",I would go back to the doctor.  He will probably give u another antibiotic.  The symptoms sound like strep but it could be something else. Th doctor may need to do a culture & sensitivity to find out exactly what antibiotic to prescribe.  Amoxil usually does get rid of strep but maybe you have something else or a different strain of strep.,The symptoms sound like strep but it could be something else.,First Aid,Health,General Health Care,,,,cause
"Why do animals which are drinking dirty water are not affected by any disease, but human being get affected?",,"The same reason americans get sick in mexico for drinking the water, while locals do not.

Our immune system is not as strong, because we are not used to it.","The same reason americans get sick in mexico for drinking the water, while locals do not.",Other - Health,Health,Other - Health,,,,information
Which fruit gives vitamn B?,,Vitamin B isn't really found in many fruits...the only one I can think of that may have a decent amount is a banana.,Vitamin B isn't really found in many fruits...,Diet & Fitness,Health,Diet & Fitness,,,,information
if i had chlamydia and took zithromax is it safe to masturbation or should i wait?,,"Chlamydia can be easily treated and cured with antibiotics. A single dose of azithromycin or a week of doxycycline (twice daily) are the most commonly used treatments. HIV-positive persons with chlamydia should receive the same treatment as those who are HIV negative.

All sex partners should be evaluated, tested, and treated. Persons with chlamydia should abstain from sexual intercourse until they and their sex partners have completed treatment, otherwise re-infection is possible.

Women whose sex partners have not been appropriately treated are at high risk for re-infection. Having multiple infections increases a woman's risk of serious reproductive health complications, including infertility. Retesting should be considered for women, especially adolescents, three to four months after treatment. This is especially true if a woman does not know if her sex partner received treatment.","Persons with chlamydia should abstain from sexual intercourse until they and their sex partners have completed treatment, otherwise re-infection is possible.",Men's Health,Health,Men's Health,,,,information
what happens if you can't stop pooping?,,Take some imodium or eat a banana!,Take some imodium or eat a banana!,Other - Health,Health,Other - Health,,,,treatment
how can you protect your theeth.?,"i know cheese is supposed to be good for stopping tooth decay. are there any other things other than brushing your teeth all the time. something that i can eat that is nice but good for my teeth, maby to kill the bacteria that make them bad?","Great question.

Try chewing Xylitol gum or sucking on xylitol sweetened mints.

These are known to actually PREVENT cavities on teeth.

The sugar in xylitol keeps the bacteria that causes cavity from causing harm to your teeth.

I have no affiliation with this company, but my patients like their products:   www.sprydental.com",The sugar in xylitol keeps the bacteria that causes cavity from causing harm to your teeth.,Dental,Health,Dental,,,,information
can emergency pills have an effect on your fertility if taken only once?,"i took emergency pills a day after i had live sex something i didnt want and i had side effects like vomiting,weakness...will it also affect my fertility since it was the first time","hey there,
A large serge of hormones that are in the pill you have taken would cause the symptoms you've mentioned. However, since you've only taken it once I doubt that it would cause any fertility problems!","hey there,",Alternative Medicine,Health,Alternative Medicine,,,,information
Why do I sometimes get yawns that won't go away?,"It's like I can't get the yawn out,and it even makes me gag.Does anyone else get this?","if you need to yawn then you need oxygen
go for a walk",if you need to yawn then you need oxygen,First Aid,Health,General Health Care,,,,cause
does watering down juice change the nutritional properties if you still take in the full serving size?,"I know grapefruit juice has many health benefits, but I hate it.  If 8oz has a certain level of benefit and I add 8oz of water to it to help ""get it down"" will I still get the full benefit of the juice (keeping in mind I'd be drinking all 16oz of liquid at this point)",I think you'll still get all the nutritional benifits because your still consuming it all. It just will take longer and be a bigger volume. It;s just the same as drinking the juice then drinking water afterwards.,I think you'll still get all the nutritional benifits because your still consuming it all.,Diet & Fitness,Health,Diet & Fitness,,,,information
"What can you count as being clinical depression, rather than mild?",Just wondering ...,"Mild depression is like mild chicken. It doesn't burn or really taste like anything, but its still there. Clinical depression is like magma, hell-fire hot chicken. You know you shouldn't eat the chicken and yet you do. Like you cant help yourself. People with clinical depression often end up like US Presidents. Then they just want to wage war.
Hope I helped.",Like you cant help yourself.,Mental Health,Health,Mental Health,,,,information
how do cur plantar fasites?,,It depends on how long you have had it.  Physiotherapy can make a difference if you haven't had it for too long.  Orthotics and exercises are next followed by night splints along with everything else.,It depends on how long you have had it.,Men's Health,Health,Men's Health,information,,,information
i think i have pinkeye but there not pink or itchy there stuck together when i wake and yellow junk in them??,they dont hurt. they water what do you think it is?,I'm going to guess a stye.  Use warm compresses on the affected eye and wash your hands constantly.  Styes are very contagious.  Contact your eye doctor.  He/She may prescribe a special eye drop for this.,I'm going to guess a stye.,Allergies,Health,Diseases & Conditions,,,,cause
What is the recommended amount of salt  person should not exceed in a day?,"I am trying to control my portion size by eating things like healthy choice and lean cuisine.  but I am nervous about the sodium. How much should a person not exceed and be healthy?  Also, is there a type of salt (sea salt kosher salt) that we can intake without worry or at least not as much worry as regular table salt?","2000-2500 mg a day for salt is what's recommended.  

Kosher or sea salt will provide less sodium mostly because the crystals are bigger.

A good rule of thumb is to not add salt unless you're cooking from scratch.  Nearly all prepared food has more than enough sodium already.",A good rule of thumb is to not add salt unless you're cooking from scratch.,Diet & Fitness,Health,Diet & Fitness,,,,information
does the return of breast cancer mean you have to have a mastectomy?,,no get glyconutrients. read my page and testimonials.,read my page and testimonials.,Cancer,Health,Diseases & Conditions,treatment,suggestion,,suggestion
Why is it painful for some people to use the toilet? What medically is wrong with them?,,"He or She may have urinary tract infection or may have piles or anal fissure or infection
 in genitals.",He or She may have urinary tract infection or may have piles or anal fissure or infection,Other - Health,Health,Other - Health,,,,cause
Does anyone know what is worse for your health? Cholesterol or trans fat??,Butter has cholesterol and margarine has trans fat...which is worse??!!,"Hello..If I have to choose beween them I would say that at any rate the trans fats are worse and cause multiple damages on our health.They clog the artheries and that leads even to heart attack.The new studies are showing the there is a good cholesterol and bad cholesterol,and amazingly the scientist found that every one needs some cholesterol.Of course,killing amounts of it will cause too many health problems. Butter is with certainty a better choice than the margarine,which is found even cancerogenic..Good luck and eat healthy!!","Butter is with certainty a better choice than the margarine, which is found even cancerogenic..",Diet & Fitness,Health,Diet & Fitness,,,,information
I was hurt. and its very itchy. Is it serious?,"Ten years ago, I was hurt in my leg near the ankle by a 'lantana camara' thorn (a small one} till today that place is black and its always itchy. Is it something serious? and what should I do?",You should go to the doctor and fast cause it sounds pretty serious.,You should go to the doctor and fast cause it sounds pretty serious.,Skin Conditions,Health,Diseases & Conditions,,,,suggestion
Coughing and feeling neck pains afterwards????,"Can anyone give me advice about the reason why I have sharp neck pains (back of the neck) that last a few seconds, sometimes longer??? Not only that, sometimes I get dizzy and my head tightens up???? Now the dizziness and the tightness of the head hadnt really happened in a while but the neck pain does??????",have u received a jolt to your body? - perhaps within the last few weeks? - sounds a bit like whip-lash which i sustained during a minor car accident a few years ago - nothing serious but uncomfortable - hope it improves soon hunny ~x~,have u received a jolt to your body?,Allergies,Health,Diseases & Conditions,,,,information
What exactly is a UTI?,"I have this burning type sensation, almost like i have to pee, but I don't and I'm not sure exactly what it is.  My boss who is a chiropractor told me that my bladder was tipped which could result in that feeling so she tipped it back the way it should be and i still have the same feeling.  I'm not sure exactly what to do.","A urinary tract infection is an infection anywhere in the urinary tract...from the urethra to the bladder to the ureters.  The bladder is normally sterile, and if you for some reason get fecal matter in the area of your urethra, the e coli bacteria that's helpful in your intestine can wreak havoc on your urinary tract.  If you don't urinate often enough to flush bacteria out of the urethra, it's able to move up it to the bladder, where it starts to cause problems.  

No matter what you do, while you're on your meds and even afterwards, drink plenty of fluids (hence the recommended 8 glasses a day) so that you urinate regularly and often.  That will help to flush some of it out of your system and keep it from coming back.

Otherwise, go to the doc!","Otherwise, go to the doc!",Women's Health,Health,Women's Health,,,,suggestion
which is the disease if a woman have burning sensation when urinating and low back pain ?,,"definately sounds like a uti, specifically kidneys with the low back pain.","definately sounds like a uti, specifically kidneys with the low back pain.",Women's Health,Health,Women's Health,,,,cause
how doe the heart sotp pumping?,,by not using spell check,by not using spell check,Men's Health,Health,Men's Health,,,,information
How do i find the nearest hospital from certain point?  Thank you.?,,"If you haven't downloaded Google Earth try that.  It will take a little bit to set up depending on your internet connection speed.  

If its an emergency right now, then I am not sure.  Sorry",Sorry,First Aid,Health,General Health Care,,,,information
My wife has breast engorgment. what should i do have u ever had it. what helps it?,please help.,express her milk..i'm thinking she just had a baby right..if not..that's strange..but yeah..express her milk and try to feed 8-10 times a day...,but yeah..,Women's Health,Health,Women's Health,,,,information
what 2  use 4 acne  scars?,"lotions, home remedys.","Acne scar treatment
http://acne-scar-tips.blogspot.com/",http://acne-scar-tips.blogspot.com/,Skin Conditions,Health,Diseases & Conditions,,,,suggestion
what is the diffrnce between Aids and HIV?,,"AIDS is a disease caused by HIV - human imunodeficiency virus. So, AIDS is the disease and Hiv is its cause.","So, AIDS is the disease and Hiv is its cause.",Other - Health,Health,Other - Health,,,,information
this bullcrap acne has to be hererdity?,"i wash my face 2times a day take baths everyday doesnt matter i still break out, my bro- in law never takes baths washes his face once a week and never breaks out wtf is that all about!","Hate to say it, but its Hereditary! I am 37 and i have had acne since i was 14. I go to the dermatologist for meds. creams for my skin. I have to user them everyday. My skin is like teenagers oily and clogged no matter what i do i have to use the meds.I'm part Irish and it came from my dads side of the family . My mom never really had ad zit even. So dont blame yourself. Go and get a referral to a dermatologist for it. There is plenty of products that help con troll it. I have found that proactive does work pretty good. Good Luck!",I'm part Irish and it came from my dads side of the family .,Skin Conditions,Health,Diseases & Conditions,,,,experience
if some is experianceing hearing loss where can they find help ?,"if they do not have insurance or a regular health care provider , is there any other resources ?",I think you need to get a hearing aid at a doctor's office.,I think you need to get a hearing aid at a doctor's office.,First Aid,Health,General Health Care,,,,suggestion
my arm hurts?,"my arm as been hurting around the area of my elbow. i dont know why its hurt i couldnt have done anything to it. its been happening for a couple of weeks now. when i try to bend my arm i get a real sharp pain in my elbow, and i dont know why? i dont play sports and i didnt work out those weeks so i dont know what it could be.",an arm attack...,an arm attack...,Women's Health,Health,Women's Health,,,,cause
if you get a bridge? how many teeth can be replaced at one time?,is there a limit such as 3 or more?,It depends on the span and where in the mouth it is. Multiple teeth can be replaced but not more than a couple in a span especially if it is the molars missing.,Multiple teeth can be replaced but not more than a couple in a span especially if it is the molars missing.,Dental,Health,Dental,,,,information
Should I take this antibiotic or not?,"I was told to take Bactrim for a urinary infection twice a day for three days but I'm breastfeeding. The doctor said it was ok but the pharmacist didn't seem so sure. I guess this would be a good moment to start weening my daugther, she is 13mos. but it's going to be so hard on her if it's done so abruptly. Any advice?","u need to finish the bactrim or it will not get any better. i have had to take it. it is ur doctor...if he says that it is alright then it is alright. he wldnt prescibe u something that wld hurt u or ur baby. since ur baby needs to not be breastfed at 13 months i suggest pumping and get as much milk as u can and then get the pads so u wnt leak everywhere and then slowly start out with like 2 ounces of breastmilk and add reg milk to a bottle and like everytime u give ur child milk keep decreasing the amount of breast milk...good luck..oh yea and if ur worried about it, call ur doc tom...he will call u back....",if he says that it is alright then it is alright.,Women's Health,Health,Women's Health,,,,information
Does a woman who is on the pill ovulate like a woman who is not on the pill?,"If you have your period during the 7 days pause, is the occurance of the ovulation process just like any other normal woman who is not on the pill?","Yes. In fact, many people are placed on the pill to regulate ovulation. This is wny I originally took it. I went for months at a time and did not ovulate on my own without the pill.
As for the new method where you only have a period a few times a year, that might have a different affect.",I went for months at a time and did not ovulate on my own without the pill.,Women's Health,Health,Women's Health,,,,experience
Is it a bad idea to eat Oranges and Jello at night?,My cousin has been craving Oranges and Jello mostly in the night is it a good idea for her to eat them if she is on a 2000 diet?,"Well,Jello is probably a bad idea because it has alot of sugar and calories.But oranges are just a fat-free fruit,so eating oranges at night,or anytime of the day,is ok.","Well, Jello is probably a bad idea because it has alot of sugar and calories.",Diet & Fitness,Health,Diet & Fitness,,,,information
Really stuffy nose?,What are some things I could do to relieve a really really stuffy nose?,Blow it!,Blow it!,Other - General Health Care,Health,General Health Care,,,,treatment
"where can I find the following herbs & how do I take them (ie-pills, etc.):?",How much will this cost me? Know of a store or website where I can find all of the herbs listed above?,"MOST HERBS CAN BE FOUND IN HEALTH STORES, OR YOU CAN GO ONLINE AND ORDER THEM. GO TO GOOGLE.COM AND LOOK FOR HEALTH STORES IN YOUR AREA!",GO TO GOOGLE.,Alternative Medicine,Health,Alternative Medicine,,,,suggestion
Is puss that is coming out of a tonsil serious?,,"Pus that is coming out of any part of your body indicates infection.  Infection can be serious, but it is easily treated.  Antibiotics may address this very well, but you will need either a prescription or knowledge of what antibiotic is necessary.  If you learn which to use, you can buy many of them in your local aquarium store.  Really!","If you learn which to use, you can buy many of them in your local aquarium store.",First Aid,Health,General Health Care,,,,information
