subject,content,answer,sentence,cat,maincat,subcat,a_perspective_1,a_perspective_2,a_perspective_3,s_perspective_1
how long will it take for birthcontrol to leave my body?,"in the past i had never felt odd when i came off of birthcontrol, ive come off of it a few different times in my life. every time my body was always on the same cycle.
but now ive come off of it and its messing my whole cycle up.
so my question is how long until its fully out of my system? its already been like 3 months.",a,a,Women's Health,Health,Women's Health,,,,information
"if someone who you're living with have flu, soon or later you'll get that flu from them.?",why is that? and what would you do to prevent it from happening?,"Probably, but if you follow the suggestions of the good answers here, might help keep you from it. The only thing I'd add, is to wash their dishes with a cap or two of bleach in the water, and make sure you don't pick up a glass they've used and drink after them.","The only thing I'd add, is to wash their dishes with a cap or two of bleach in the water, and make sure you don't pick up a glass they've used and drink after them.",Infectious Diseases,Health,Diseases & Conditions,,,,treatment
Is it weird to ask my doctor if I can get a MRI done?,I am 21... Since middle school I've always said I don't feel right. I use to joke about a brain tumor but sometimes I think I really do have one.Lately I have had more and more headaches like 4 times out the week that sometimes don't go away with Medicine. my vision is good except one eye is 20/20 and the other is 20/40. You don't usually see that. I tend to get dizzy a lot or my vision gets a little cloudy. Should I ask my psychian can I get a MRI just for a check up????,"Go ahead and ask, no question is dumb for the doctor.","Go ahead and ask, no question is dumb for the doctor.",Other - Health,Health,Other - Health,,,,suggestion
How can you tell when someone is showing signs of Schizophrenia vs. Paranoid Personality Disorder?,,"First off, there ARE known neurological differences in people with Schizophrenia--these include increased levels of the neurotransmitter Dopamine and in some cases, enlarged ventricals, among others.  If someone is having intense delusions or hallucinations, it may be Schizophrenia.  People with Paranoid PD usually do not have hallucinations.","First off, there ARE known neurological differences in people with Schizophrenia--these include increased levels of the neurotransmitter Dopamine and in some cases, enlarged ventricals, among others.",First Aid,Health,General Health Care,,,,information
Could it be serious?,I have asnipp in my back. i have been born with that snipp but now it is really itching.what could it be?,"i don't really know what that is but you should talk to your parents & doctor, and pray!! so God will heal you!!
i'll be praying for U!(even though i have no clue who U R!)
keep your hopes up!",so God will heal you!,Women's Health,Health,Women's Health,,,,information
Why the 10% of saturated fat in most of the nuts not considered harmful for health? Why they good for heart?,Can I eat nuts while my colistrol level is at the 220's?,"avoid saturated fats...and yes have nuts,,,,they have good fats and protiens","and yes have nuts,,,,",Diet & Fitness,Health,Diet & Fitness,,,,suggestion
is it ok if i skip a month of my period if i got it last year?,ok well i got my period the summer b4 i went 2 8th grade and now i'm in 9th so is it ok?? its almost the end of november and i still didnt get my period!!! it was exactly month on the 12th that i didnt hav my period so i'm about a week and 2 days late is that ok??,no go see a doctor,no go see a doctor,Women's Health,Health,Women's Health,,,,suggestion
Dizzyness?,"Whenever I have been sitting for a while staring at something, or just when I am walking around, I kind of have dizzy spells. I can't see for about twenty seconds because my eyes get filled up with little pixel-like things. They are gray squares that go and fill up my eyes, a few pixels at a time. Once while this was happening, I closed my eyes and I went into a little sleep-like stage for a minute until I realised that I was just standing there. Does this happen to everyone, and if not could it be a health problem?","sometimes if i have been laying down for a while and get up, i feel dizzy and can't see for a few seconds.  after it goes away i feel fine.  i have heard that sometimes dizzyness is caused by low blood sugar or blood pressure.",i have heard that sometimes dizzyness is caused by low blood sugar or blood pressure.,First Aid,Health,General Health Care,,,,cause
can computers give you cancer on your eyes and if it can who made the study?,,yes it can,yes it can,Cancer,Health,Diseases & Conditions,,,,information
I sleep but I don't dream. Is that even possible?,"I say I never have dreams, but my wife says I do or my mind would go crazy due to lack of resting my mind. I say I sleep but I don't dream. I wake up rested but I always feel like it was a waste since I didn't dream anything.","Yes, because I have not dreamed as far as memory is concerned","Yes, because I have not dreamed as far as memory is concerned",Mental Health,Health,Mental Health,,,,information
I was exposed to TB and I want to know does that mean I actually have TB like someone who is active?,"I'm not ashamed or anything,just curious as to what my T.B status is.Thanks...","Hi there...

I could not tell you for sure but I have taken some EMT classes and here is what I know.  Just because you are exposed does not mean that you necessarily have TB but there is a really good chance that you probably would.  My best advice to give ya is go to a free health clinic and get tested.  I really hope that everything turns out okay!!!

Thanks and hope this helps ya!",Just because you are exposed does not mean that you necessarily have TB but there is a really good chance that you probably would.,Respiratory Diseases,Health,Diseases & Conditions,,,,information
When they say vitamins and minerals - what are minerals...?,"Specifically, how are they helpful to the body?
Thanks","Consult a periodic table of the elements where you will see all the elements.  Minerals are inorganic elements.  Of the 92 naturally occurring elements, the 14 minerals that have been shown by research to be essential to human health are: calcium, chromium, copper, fluorine, iodine, iron, magnesium, manganese, molybdenum, phosphorus, potassium, selenium, sodium and zinc. Iron (Fe) is a structural part of the heme portion of hemoblogin, the protein in ethrocytes (red blood cell).  Electrolytes are the elements necessary for electrochemical activity in the  body such as nerve impulse transmission. The positive (cations) Sodium (Na), Potassium (K), Magnesium (Mg) and Calcium (Ca) and the negative ion Chloride (Cl) are balanced in the body.  Bicarbonate HCO3 and Phosphate PO4 also function as negative ions and buffers.  Some minerals are stored in the bones and function to support the structure.  If you look for books on human physiology in the library, you will find all the functions of minerals in the body.",Consult a periodic table of the elements where you will see all the elements.,Other - Health,Health,Other - Health,,,,suggestion
How to make nice rapport with the Nursing staffs while in doing medical residency? Any special tips for FMGs?,"I understand daily greetings, smiling,wishing for special days, being co-operative, poilite ... all these are universal in making good rapport with anyone. Cutting jokes, taking part in light talks regarding regional, colloquial issues help a lot ... but it's difficult for foreign med. graduates(FMGs)to break the barriers intially despite their honest wishes to do so. During the steam-rolling of residency where is the time to expend to get/feel the local pulse?","There is not much time to ingratiate yourself in the culture, so you are up for a challenge.  My guess though, is that you will do just fine.  You are unique because you are actually thinking about the importance of establishing a good rapport.  That puts you 10 steps ahead of all the other residents.  Just relax, don't try too hard, be polite, and don't hit on the cute nurses!","There is not much time to ingratiate yourself in the culture, so you are up for a challenge.",Mental Health,Health,Mental Health,,,,information
I read that eating lots of nuts can combat depression how does it work and why?,"I thought ok sounds like complete bollocks but I'll keep my mind open, I ate packet after packet of nuts and i still feel suicidal, so where is the flaw in this? Have i disproven this? I eat right i sleep right and yet, I exersize, I won't be sleeping tonight cause of all the god damn nuts rolling around my stomach.",It won't change your feeling of depression but it might brighten up the day for the guy you are teabagging!,It won't change your feeling of depression but it might brighten up the day for the guy you are teabagging!,Mental Health,Health,Mental Health,,,,information
what is the normal number of heart bet for aperson in the mid of fifties?,,Try the info on the CDC site below:,Try the info on the CDC site below:,Heart Diseases,Health,Diseases & Conditions,,,,suggestion
what are some nat. remdies for hot flashes ?,menopausal hot flashes,"Sex and lots of it. That is a fact,ask your doctor.",Sex and lots of it.,Women's Health,Health,Women's Health,,,,treatment
can you eat tomatoes and other foods with small seeds if you have diverticulitis?,,"No.  My sister has diverticulitis and can't eat any nuts or anything with seeds.  They can get caught in the small pockets and cause infection and severe pain.  I grow a type of tomato that has a lot of meat and very few seeds.  It is called a Russian Imperial.  She just removes the few seeds and can then eat the tomato.  Do not eat strawberry's, blackberrys, rasberry's or anything that you cannot remove the seeds.",They can get caught in the small pockets and cause infection and severe pain.,Other - Diseases,Health,Diseases & Conditions,,,,information
How do you get rid of a really bad earache?,,"Pour a small amount of hydrogen peroxide inside the ear then quickly flush it out. If you pour too much in or you leave it in too long, it may cause ear damage. only about 1 second!","If you pour too much in or you leave it in too long, it may cause ear damage.",Other - General Health Care,Health,General Health Care,,,,information
if i masturbate too much will my penis get any smaller?,,If u talking about ********** no,If u talking about ********** no,Men's Health,Health,Men's Health,,,,information
My husband had an important meeting today but he is now complaining of a pain inbetween his shoulder blades?,and he has said he can't lean forward comfortably.,stress can cause it. Tell him to take some deep breathes and try to relax. If that doesn't work tell him to take some Ibprophine with a cup of warm tea.,stress can cause it.,Pain & Pain Management,Health,General Health Care,,,,cause
Women only please.....?,ok my menstrual is very regular....untill about 2 weeks ago......I have not started my period but i have been spottin between periods something i have never done before and it has been happening for the entire month of november....yes there is a chance i could be pregnant because i live and have unprotected sex with a man....the blood that I am spotting is dark am i pregnant or is something wrong......please help......i cant go to a doctor yet so if you could just tell me if it has happened to you.....and what it could be and if its fixable,"Yes the same thing happened to me. I was spotting, and even cramping alittle. Sure enough I was pregnant.  It was exactly 2 weeks after I had my period, and I knew something was up because It wasn't time to start my period again. I was on vacation ( which was when I concieved) and it started like the next day. I learned that sometimes there is bleeding and cramping as the egg implants. So Congrats!",Yes the same thing happened to me.,Women's Health,Health,Women's Health,,,,experience
how do you remove wrinkles from your penis. (serious)?,My penis has many wrinkles and the older I get the more wrinkles I get.,They go when you have a stiffy.,They go when you have a stiffy.,Men's Health,Health,Men's Health,,,,information
Does a physician have to be present when administering contrast for a CT and or MRI?,,No. The CT or MRI technician is trained to administer the contrast.,The CT or MRI technician is trained to administer the contrast.,Other - Health,Health,Other - Health,,,,information
is a*n*a*l sex safe during pregnancy?,,It is safe as long as your doctor didn't tell you not to have sex all together,It is safe as long as your doctor didn't tell you not to have sex all together,Women's Health,Health,Women's Health,,,,information
How can I make my blood blister quit hurting?,I got a blood blister earlier today and drained it. It seemed fine all day but now it hurts like hell. It did not swell again either.,"Yep, they hurt. Vaseline takes the soreness out. Put some on it and put a bandaid over it. It is just going to take a day or so.","Yep, they hurt.",First Aid,Health,General Health Care,treatment,,,information
How harmful is...?,I just wanna know how harmful can gall-stones be. Da ones that get formed in your gall bladder. Are they really harmful and what are the effects of it??,"horrible bowel movements. you have to go to the bathroom and it hurts so bad you are sweating and nauseas and laying out on the floor...also, the stones can leak poison into your system if they stay there long enough.",you have to go to the bathroom and it hurts so bad you are sweating and nauseas and laying out on the floor...,Other - Diseases,Health,Diseases & Conditions,,,,information
what is the latest and best medecine for bipolar?,,This is a very good website which gives you near all info needed for this disorder.  www.BipolarManiaInfo.com,www.BipolarManiaInfo.com,Other - Diseases,Health,Diseases & Conditions,,,,suggestion
Is there a doctor or someone who knows about certain meds out there?,I am having a problem with a med the doctor had given me for a eptopic pregnancy and want a little more info on this med.,And the name of the medicine is?,And the name of the medicine is?,Women's Health,Health,Women's Health,,,,information
does advair raise  your blood sugar level?,,"yes it is the reason that my husbands grandmother cannot take it... she is an insulin dependent diabetic... and the doctor says no, due to the effects on the blood sugar","yes it is the reason that my husbands grandmother cannot take it... she is an insulin dependent diabetic... and the doctor says no, due to the effects on the blood sugar",Respiratory Diseases,Health,Diseases & Conditions,,,,experience
Small red bumps on my side.  What are they?,"I have these bumps about a centimeter wide that are red but they don't itch or hurt.  No puss or nothing.  I have them mostly on my sides and they are slowly spreding.  Its like pink and redder around the actual bump.  They're not very high either.  I noticed this about 4 days ago.  No other symptoms.    I have a girlfriend and I spend a lot of time with her and she don't have whatever it is.  

Any tips or advice would be very much appreciated.","If You were having any kind of pain, I'd say it sounds like shingles. Pain doesn't have to be in area of rash itself. Have you had cold/flu like symptoms. Might be worth checking into. If you think it is shingles get to dr. and get on anti-viral meds asap.",Have you had cold/flu like symptoms.,Skin Conditions,Health,Diseases & Conditions,,,,information
Does use of mobile causes Brain Tumour????,,"I don't know about any info. being 'suppressed', but several medical studies have looked at this issue recently (and been published in the medical literature for anyone to read).  The results of these studies have been mixed.  Some suggest a risk of cancer and some were not able to show an association.  Overall, it would be prudent to consider the positive findings of risk and keep your cellphone use to a minimum.

Best wishes.",Some suggest a risk of cancer and some were not able to show an association.,Cancer,Health,Diseases & Conditions,,,,information
How can I make my period lighter without using birth control pills?,,"Women who engage in frequent, strenuous exercise often find that their flow diminishes. So how do you feel about marathon running, body building, etc?","So how do you feel about marathon running, body building, etc?",Women's Health,Health,Women's Health,,,,information
Does anybody know WHY sleeping in front of a fan causes a stiff neck?,"I think it is especially bad if you go to be with wet hair too, I know it is an old wives tale but it does actually happen I just dont get why. Anybody?","Bell's Palsy.

http://www.webmd.com/hw/brain_nervous_system/hw179179.asp",Bell's Palsy.,First Aid,Health,General Health Care,cause,,,cause
"What is ""endartenetomy"" in coronary artery bypass surgery?",,"An endarterectomy is not uncommonly performed in the context of a coronary artery bypass grafting (CABG, aka open heart surgery, bypass surgery)  It is actually incising the artery (opening it up and sewing it back closed along the length of the artery) to clean out the plaque.  

I once knew a cardiothoracic surgeon who collected the gunk from the arteries of all his patients and kept it in a five gallon bottle in his office.  The point was to show patients how much gunk gets in people's arteries to clog the works.  It was gross, but effective, I am sure.",The point was to show patients how much gunk gets in people's arteries to clog the works.,Heart Diseases,Health,Diseases & Conditions,,,,information
Do you think I will be able to find a dentist anywhere that will put me under to clean my teeth?,"I have a serious phobia about the dentist.  I know I have a couple cavaties and need to go get them filled.  I also really need to have  my teeth cleaned.  Do you think I could find anyone to put me under??  I know it sounds ridiculous, but it would just be so much easier.","Yes, many dentists now offer sedation dentistry. You go and get a perscription for a sedative the day before and you take it like an hour before your appointment. You will probably sleep for the whole procedure.",You go and get a perscription for a sedative the day before and you take it like an hour before your appointment.,Dental,Health,Dental,,,,treatment
what is psorosis liver and what are the symptoms?,my mothers an alcoholic and now both of her feet are swollen is that an symptom of the psorosis liver,The swelling of the feet/ankles may be indicative of an underlying heart problem. I'd have her go see a Doctor.,The swelling of the feet/ankles may be indicative of an underlying heart problem.,Other - Diseases,Health,Diseases & Conditions,,,,cause
Has anyone gotten a laser treatment for acne?,"If, so how much is the price and how effective was it?","If youre looking for accurate acne information, best to see a dermatologist. Some people believe doctors are predisposed to take the easy way to deal with acne prescription drugs. But, with many, this simplistic answer may not be the appropriate course of action. Some feel that such prescription drugs just treat the symposium and not the underlying cause. But, a local dermatologist is still your best starting point.

For me personally, I discovered a great informational acne treatment site. Not only is there good information/articles but I got their audio e-book and following its advice can now say that my acne is a thing of the past! Keep in mind, were all different and there are various types of acne, so what works for some may not be totally effective for all.

Bottom line, hang in there, you will get past this! Sincere best wishes and good luck.
Oh, by the way the site that helped me is:
http://www.acne-treatment-medicine-1.info

http://www.medical-research-study-directory.info/
http://www.lasik-surgery-san-diego.info/
http://www.san-diego-dentist.us
http://www.san-diego-plastic-surgery-cosmetic-surgery-doctors.us/","If youre looking for accurate acne information, best to see a dermatologist.",Skin Conditions,Health,Diseases & Conditions,,,,suggestion
I'm 15 and my breast seem to ache at most of the times.why is that?,like they seem to give a little pain but it doesent hurt really.and my breast size is 34A.,your body is going thru huge hormonal changes at your age.  It is typical to have breasts that are tender and ache.,your body is going thru huge hormonal changes at your age.,Other - Health,Health,Other - Health,,,,information
I was told a have a sinus arythmia and not to worry about it?,"Why do I have it and what does it mean and should I not worry about it? My heart skips beats a lot.
I get some pains around my heart just like brief spasms sometimes when I exercise. I am 53.","unless it's an atrial flutter, it's probably not a big deal...see a cardiologist and have them hook you up to an EKG monitor for 24 hours and see what they say.",see a cardiologist and have them hook you up to an EKG monitor for 24 hours and see what they say.,Heart Diseases,Health,Diseases & Conditions,,,,suggestion
"Does anyone know of any fat burning pills that are healthy for kids and teens, if so where can i find them?",,Never give anything like that to a kid... get them away from the TV and outside playing and it will come off... also take the shild to the doctor. If they are obese it might be a sign of a underlying illness,Never give anything like that to a kid... get them away from the TV and outside playing and it will come off... also take the shild to the doctor.,Diet & Fitness,Health,Diet & Fitness,,,,suggestion
I keep itching all over in diffrent spots on my body it lokks like hives but then go away in like 20 min?,What do u think it is stress?? Ive havent changed any soap or detergent.  Could it be my dog?? But Ive had him for 1 year now?? My life has been stressful as of late.  Should I go to the doctor??,"take an antihistamine. i have an Rx fro hydroxyzine. its great. there are over the counter ones too. ask a pharmacist.
see if that works.
also a nice Luke warm bath and then lotion like lubriderm or nutriderm , no fragrance!!!.. hydrate helps stop the itch too.

keep a record of what you eat. and use up to 8 hours before. could even be air fresheners or cleaners or pollen your breathing in.
you may need to get allergy checked.

hormones and other immune factors make what we are and aren't allergic to change over time,.AND STRESS CAN MAKE YOU MORE SUSCEPTIBLE.

just because you haven't changed your products doesn't mean they haven't changed the formula! 

and i can have one thing one day and then not the next.
only have big worries if your face mouth or tounge swells or oyu have other breathign difficulties or racing heart.. otherwise its mostly just annoying. good luck!",you may need to get allergy checked.,Skin Conditions,Health,Diseases & Conditions,treatment,information,,suggestion
Can kissing pass on STDs if fully clothed and kissing on the lips and no cuts or anything in the mouth?,,"yes, cold sores; they aren't necessarily an STD but they are considered Herpes, and are contagious (most people get them after having fevers though).","yes, cold sores; they aren't necessarily an STD but they are considered Herpes, and are contagious (most people get them after having fevers though).",STDs,Health,Diseases & Conditions,,,,information
i got a splinter in my finger i pulled it out and now i cant hardly bend it?,,"I agree with others, if you don't get it treated...it my swell up the size of two fingers.  This just happened to a friend of mine.  See a doctor.",it my swell up the size of two fingers.,Women's Health,Health,Women's Health,,,,information
Treating kids with ADD naturally?,"Who has treated their children with ADD naturally, with vitamins, minerals, etc...
And what were the results?
Thanks!",Once upon a time children with ADD were treated naturally at home by loving parents with thick belts.  If they only knew how enlightened and peaceful our society would one day become.  The youth of today are so much more polite and well-behaved than the violent hooligans of the past that it is obvious we have finally found the solution in medication. (end sarcasm).  I say congrats to you for at least attempting to naturally treat your kids.  There's too much drug therapy going on today.  Sorry I can't help you with any natural treatment though.,The youth of today are so much more polite and well-behaved than the violent hooligans of the past that it is obvious we have finally found the solution in medication.,Other - Diseases,Health,Diseases & Conditions,,,,information
How to deal with a hypochondriac?,"My sister is a 42 years old independent divorced woman with two kids. She is depressed and lately hypochondriac, she is finding illness that doesn't exist. She made took her to the ER and they told me she had nothing, she keeps visiting doctors and saying she has kidney failures, migraine, anemia, etc, etc. I can't stand talking to her because she always tells me how bad and sick she is. Refuses to psychological help and now she is finding illness in her kids (11 and 9 years old) she claims they have gastric problems, attention disorder... What do I do??? Now she is making ME sick.","I am so sorry; this sounds like a very frustrating situation.  It seems like all you can do is continue to love her and encourage her to get mental help.  Maybe she's not ready to accept that idea now, but maybe she will be in the future.",It seems like all you can do is continue to love her and encourage her to get mental help.,Mental Health,Health,Mental Health,,,,suggestion
