subject,content,answer,sentence,cat,maincat,subcat,a_perspective_1,a_perspective_2,a_perspective_3,s_perspective_1
Sore tooth?,"I was eating some ice cream last night and one of my teeth started to hurt. It wasn't a really bad pain, it was more of a dull ache, and it lasted for a couple of hours. Does that mean I have a cavity? Or is the tooth just a bit sensitive?","The extent of sensitivity to cold can be determined by the strength of the enamel of a tooth. You may be sensitive to cold alone, but you may have a cavity. Your best bet is to see your dentist of course, as he or she will be the only one to tell you if you have a cavity. If you merely suffer from sensitivity, then you may want to try a toothpaste specifically designed to deal with this. My dentist changed my toothpaste to Sensodyne, because me teeth are soft and very sensitive. It does help. As I always say however, home remedies are great only if you aren't merely treating the symptoms of a larger problem.",The extent of sensitivity to cold can be determined by the strength of the enamel of a tooth.,Dental,Health,Dental,,,,information
My M.D. asked me for a Thyroid check up. He claims Lithium is harmful for the Thyroid Glad. Any M.D. Answer ?,"I will greatly appreciate other M.D.'s opinion whether this is so.
Got to take Lithium for the rest of my life and I've been having uncontrolled jerks while asleep and my Doctor is afraid that Lithium may be causing those sudden changes in my breathing rithm and uncontroled muscle movements. I only take much less than prescribed (just 150 milligrams a day )
When I don't take it I get depressed and can not eat nor sleep. Please HELP !!!","It is true that lithium can affect the thyroid gland (potentially making it underactive); and it can also affect your kidneys - this is why anyone on lithium should have periodic blood tests for thyroid and renal function, regardless of any symptoms. If your thyroid gland DOES become underactive, it is usually a simple matter to supplement with levothyroxine daily; and is therefore not such a big deal.
Generally the benefits of lithium in people with bipolar disorder or difficult to treat depression are considered to outweigh these risks; and this is why many millions of people are (safely) on lithium. This is especially true if you take a lower-than-average dose (as you do); because the chances of potential harmful side-effects ARE lowered with lower serum lithium levels.
The 'jerks' you mention dont sound related to your thyroid OR your lithium levels (which usually causes tremor if too high); but there is no harm in checking up on these.
Has he considered other diagnoses such as myoclonus or Tourette's Syndrome? Are you on any other medication?",Are you on any other medication?,Mental Health,Health,Mental Health,,,,information
How do you know if you have a bladder infection?,,if you have problems going to the bathroom or if it hurts to go. get it checked by a doctor.,get it checked by a doctor.,Other - Health,Health,Other - Health,,,,suggestion
Can FIBER make you slimmer?,best answer gets 10 points,"I do know that it can slough a lot of toxins and buildup out of your @ss, which is a good thing in itself. FIBER = GOOD! YUM!",FIBER = GOOD!,Diet & Fitness,Health,Diet & Fitness,,,,information
Tiny blisters on m fingers. Very itchy and I can never get rid of them.?,"These tiny blisters filled with liquid always show up on the same left hand ring finger for a year. It starts having them again and again every time skin peels off, skin dries up like crazy and new skin grows. They won't go away. Finger becomes very itchy and it's hard to resist scatching it.Tiny blisters show up on my other hand too but they go away faster. Lotion doesnt work and I dunno what does. I'm hopeless. I dont wanna have them for the rest of my life.","Sounds like an allergic reaction of somekind, i would see your doctor.....","Sounds like an allergic reaction of somekind, i would see your doctor.....",Skin Conditions,Health,Diseases & Conditions,,,,suggestion
why do i have to stand up for a pee?,i have kidney problems were i get a lot of kidney infections when i go to the toilet to wee nothing comes but when i stand up i can go can some one tell me why this is oh and by the way i am a  woman.,Physics.,Physics.,Women's Health,Health,Women's Health,,,,cause
Does dental insurance usually cover part of the cost of a mouth guard you get at a dentist or periodontist?,I am going to be getting a mouth guard and need to know if dental insurance will cover it.  It is for receding gums due to clenching.,"No, I have excellent insurance as well, and mine did not cover a mouth guard for TMJ.  Sorry.",Sorry.,Dental,Health,Dental,,,,information
Whats up with...............?,"Hey I need all the dirt (Good and Bad) on birth control.
I can't Ask my Doctor cuz my mom always comes to my apponintments with me. And don't worry bout my age im 15 and a bout to be 16 so im straght.
One of my friends is on it. First she started out on the patch untill her auntie called her about 21 Women who died from the patch in Tennessee and how it was all over the news and she was also one of those girls who had no shape ( a stright up Tree) and the pill enhanced (made bigger) her breast, butt, thigs, and stomach. shes not fat she just got shape. and i allready have a big butt, small waist, and a large breast (am i the only one who wants her **** to stop growin?) so i cant afford to blow up my hour glass shape would be distroied!!!!!!!!!!

and my BoyF wouldnt be too happy bout that! or would he?","If you're asking as a contraceptive, then it's not the most effective way, condoms are.","If you're asking as a contraceptive, then it's not the most effective way, condoms are.",First Aid,Health,General Health Care,,,,information
Health Care Survey?,"For those of you love completing surveys

http://theaplan.biz/benefits123",healthcare free in U.K we have a national health service.,healthcare free in U. K we have a national health service.,Dental,Health,Dental,,,,information
swhat antibiotic is used in treating gum abcess?,,"First: Get to a dentist!

If the infection is less than 3 days old, they can prescribe Pen VK. If older than 3 days, Augmentin. If allergic to penicillins, Clindamycin. All need a loading dose.

Amoxicillin is NOT to be used for an abcessed tooth. I know it's often used, but it does not have a good effect against a bone infection.

 When given the antibiotic, make sure you take ALL of it - even though you'll feel better before you're done with it. 

After the pain goes away, do not forget about it, the infection WILL come back until the tooth is treated."," When given the antibiotic, make sure you take ALL of it - even though you'll feel better before you're done with it.",Dental,Health,Dental,,,,information
is there a chance of getting leg replacement for amputees?,,"From what I understand about nerves and the way they work, they can't be patched together. There are other technologies used to make prostetic limbs that can move similar to natural limbs. These are using electrodes implanted in the brain to pick signals up the brain sends to stimulate the natural limb to move. They are attached to a prostetic limb controlled by electronic mechinisms to move. There is no feeling but it can move. I don't think it's being used in the public as of today.",I don't think it's being used in the public as of today.,Other - Health,Health,Other - Health,,,,information
"My friend has been told he has an abnormally high ""inflammatory count"" following blood tests. Whats this mean?",,Possibly linked with elivated white blood cells.,Possibly linked with elivated white blood cells.,Other - Diseases,Health,Diseases & Conditions,,,,cause
Has anyone used ear acupuncture to stop smoking?  Did you succeed?,"I have an appointment to get ear acupuncture next week.  I truly want to quit smoking again (4th attempt in 10 years). I am lookin for success stories.  Also, people who haven't succeeded and what happened to make you go back?",Yes it works!  I was getting it 3 or 4 times a week at first.  In Nova Scotia it's a free service provided by our government.   I peetered down to once a week and then stopped going.  I had been smoke free for 6 months.  When I stopped going to acupuncture and some stresses at home occured the smoking started again.  I am just resuming the treatments...  hopefully it will work.  My doctor suggested Welbutrin as the best option but it's an anti-depressant and I really don't want to start taking drugs that might alter how I will feel.,In Nova Scotia it's a free service provided by our government.,First Aid,Health,General Health Care,,,,information
How come I am mentally disabled and I can do everything in life?,"The social security administration found me mentally disabled. Also the 3 doctors and phychiatric hospitals diagnozed me as schizophrenic, schizophreniform, and schizoaffective disorder. Yet, I can drive, I can take showers, shop, play computer games, etc.. so how am I disabled then? please help. I receive a monthly income of $832 disability benefits. thanks",Didnt you just ask how you can get cancer i read that but left no answer cause i thought that was a strange question... but anyways a docter can be wrong about you however 3 docters are usually right. Just sit back and enjoy the money u are getting.,Just sit back and enjoy the money u are getting.,Mental Health,Health,Mental Health,,,,suggestion
Why do I get bad cramps in my side when jogging and walking?,"I recently took up a new work-out regimine, and I run/walk three miles a day and I plan to raise it by a mile every other week...  But everyday, about halfway into my workout, I get awful cramps in my right side.    Sometimes the cramp runs along my whole ribcage and sometimes just in the middle area.  What can I do to prevent this?  And what is a good way to make them go away?  Thank you for your help!",You need to start practicing breath control when you run try to use a pattern and consentrate on taking the same breath in and releasing it out fully. you breath in fresh air and breath out air that lacks oxygen so if you are brathing fast you suck in the air with no oxygen this causes cramps also.  if you drink soda and eat greasy foods thats probably the first thing that you should work on ok.,You need to start practicing breath control when you run try to use a pattern and consentrate on taking the same breath in and releasing it out fully.,Diet & Fitness,Health,Diet & Fitness,,,,treatment
whats anal leakage?,what is it i think i have it how can i prevent it,"I was under the impression that it is a ""wet fart"" (sorry) after eating too much of a certain kind of food. i've only heard the term on mad tv, they did kind of a hilarious skit on it. haha.","I was under the impression that it is a ""wet fart"" (sorry) after eating too much of a certain kind of food.",Men's Health,Health,Men's Health,,,,information
Has anyone heard of lower lumbar L5 Gild Surgery?  2 Discectomies have not worked; looking at a 3rd surgery.?,"A relative told my husband and I to check out a surgery called ""lower lumber L5 Gild"" surgery.  My husband has already had two surgeries to repair a disc and and is now scheduled for a third one on the same (L5-S1) disc in a few weeks.  We don't want to go through this again and again.  If anyone knows any resources or information where we can learn more about this new procedure to end my husband's leg and back pain, please let us know.  Thank you.  Tammie",Back surgery is a money making scam that the medical association should be ashamed of.,Back surgery is a money making scam that the medical association should be ashamed of.,Pain & Pain Management,Health,General Health Care,,,,information
Any medical people out there?,"I know no one over the computer can diagnose me so please do not tell me that. Also please do not tell me to get to the dr!
My story is kind of long. I will fit it here as best as I can. Basically I have been having all kinds of health problems.I do not have insurance and a limited budget so I have been to the doctor but not like I SHOULD be! I need to know if my symptoms are symtoms of anything specifically so I can be sure exactly what to look into. Also I have taken three pregnancy tests all negative. So that has been ruled out! I have limited space so even though some of my symptoms require details I am not included them just listing symtoms
No appetite
When I do feel hungry get nauseous after eating
headaches (almost constant)
BAD pains in stomach
gassy
low energy
heightened sense of smell
constipation
not vommiting at all but feeling nauseous a lot of the time
blurred visions
irregular cycle 
Theres more but those are the most daily things. About the past month or so",If you haven't had it out already it could be your gallbladder. Since you do not have insurance (I would look into Medicaid) you could try sticking to a low fat bland diet. See the website below for ideas. This helps if it is your gallbladder. Also if your pains get worse DO NOT WAIT go the ER IMMEDIATELY. If you do have gallstones they could fall into the common bile duct and you get could get seriously ill and may need emergency surgery. Take cae and good luck.,See the website below for ideas.,Women's Health,Health,Women's Health,,,,suggestion
Is it common to have nausea during anal intercourse?,Some times during anal intercourse my wife will get nauseated she doesnt expierence pain and it usually happens as i  fully  penitrate her. if she doesnt get nauseated she enjoys it and can have an orgasm from it.,"her body has to get adjusted to it, before you know it, she'll be fine","her body has to get adjusted to it, before you know it, she'll be fine",Women's Health,Health,Women's Health,,,,information
"blood,question?","why was i born with RH,NEGATIVE BLOOD?
IS IT BAD TO HAVE THAT KIND OF BLOOD?","you were born with RhD negative blood because you inherited then genes from your parents - one from each.

as far as is it bad - approximately 15% of the world population is RhD negative - so trust me - its not dangerous or we'd be doing something about it!!!!",as far as is it bad - approximately 15% of the world population is RhD negative - so trust me - its not dangerous or we'd be doing something about it!!!,First Aid,Health,General Health Care,,,,information
What side effects are there with a Mitral Valve Prolapse? I have this condition -I have to take Amoxicillin..?,"Before Surgury, Dental Cleanings etc. Yesterday I found out that an online friend died from complications from this. My Doctor hasn't told me of any possible complications or side effects. If you are a Doctor, Nurse or a person with this Disorder etc. who can shed some light on this-I would greatly appreciate hearing from you. Your information could save my life or the life of other people reading this.","Amoxicillin is prophylatic for Endocarditis.  Since you have MVP ( Mitral Valve Prolapse) there is high possibity for Mitral Regurgitation, (blood flowing to the atrium when contraction, instead of going in to the Aorta).  This regurgitant jet will cause damage to the lining of the atrium in due course of time that area might be infected, which will be cause of endocarditis, thats why you are given prophylactic antibiotic therapy.

Complicaiton for MVP: 

Infective Endocarditis, Thrombosis of Left Atrium, Emobli Event, Arrhythmia, Pulmonary Hypertension, Congestive Heart Failure.

Other than that, complication can be of any type if not treated or due to secondary conditions.","This regurgitant jet will cause damage to the lining of the atrium in due course of time that area might be infected, which will be cause of endocarditis, thats why you are given prophylactic antibiotic therapy.",Heart Diseases,Health,Diseases & Conditions,,,,information
"When a female has her period, she feels extremely sexually excited?",what exactly does she feel when having period? My girlfriend tells me she feels horny all over her body,it happens,it happens,Women's Health,Health,Women's Health,,,,information
What is dyslexia?,,It is a problem with your brain that makes words and letters scramble when your reading them.,It is a problem with your brain that makes words and letters scramble when your reading them.,First Aid,Health,General Health Care,information,,,information
whats the best remedy for a cold?,,"niquil , lots rest, and drink plenty of water..","niquil , lots rest, and drink plenty of water..",First Aid,Health,General Health Care,,,,treatment
"Which herb is better for pms and hormone balance,Dong Quai or Evening Primrose oil?",,"Evening primose oil but it needs to be organic.  Eat more soy (not modified)  and drink more beer (full of oestrogens ) !!  

take care",take care,Women's Health,Health,Women's Health,,,,information
Has anyone ever heard of kalawalla for people with MS?,Kalawalla is fern that grows in Honduras and is use to ease the symptoms of MS.,Yes I have I take it,Yes I have I take it,Alternative Medicine,Health,Alternative Medicine,,,,experience
Why do we have wisdom teeth and then eventually they have be to pulled out?,,"Most adults don't have room in their mouths for them, causing the other teeth to crowd.  
More importantly though, the wisdom teeth roots will grow into your jawbone eventually and your jaw will have to be broken to have the teeth removed.","Most adults don't have room in their mouths for them, causing the other teeth to crowd.",Dental,Health,Dental,,,,cause
What is the standard recommended daily requirement of Vitamin D3 for men and women in the age group 45 to 65?,,"The dietary allowance set by the National Research Council is 400 IU per day for all healthy individuals who have no exposure to ultraviolet light. The Daily Reference Intake (DRI) had been set at 200 IU, and it was recently tripled for people over 70 years of age, to 600 IU per day - but for everyone else, the DRI remains at 200 IU.",The dietary allowance set by the National Research Council is 400 IU per day for all healthy individuals who have no exposure to ultraviolet light.,Diet & Fitness,Health,Diet & Fitness,,,,information
Is Dizziness something to worry about?,"For the past month, I have been getting many dizzy spells and recently it seems to get worse.  Today,  I felt like I was going to pass out.  I grabbed something from the floor and when I got up, everything got darker and I felt like I wanted to fall.  This doesn't just happen when I get up fast.  I was sitting at a table and all of a sudden,  I started getting really lightheaded and my ears seemed muffled and then the feeling went away.  At first I shrugged it off but now I notice that it is getting worse.  Any info will do.",See your doctor.  Definitely a good idea to have something persistent like this checked out.,See your doctor.,Other - Health,Health,Other - Health,,,,suggestion
What is the difference between a double eye lid and a single eye lid?,What is the difference between a double eye lid and a single eye lid.  I think mine is double?,two folds of skin over eye,two folds of skin over eye,Other - General Health Care,Health,General Health Care,,,,information
"I would like to know the affects, if any, for someone with COPD living in a moblile home?",Are there things used in the construction of mobile homes that would not be safe for COPD patients to be in. Would it cause more problems with their symptoms. Are would it be better to live in a house.,if you use good HEPA air filtration you should be fine.,if you use good HEPA air filtration you should be fine.,Respiratory Diseases,Health,Diseases & Conditions,,,,information
Is it weird if I want to ask my doctor to give me a MRI????,I am 21... Since middle school I've always said I don't feel right. I use to joke about a brain tumor but sometimes I think I really do have one.Lately I have had more and more headaches like 4 times out the week that sometimes don't go away with Medicine. my vision is good except one eye is 20/20 and the other is 20/40. You don't usually see that. I tend to get dizzy a lot or my vision gets a little cloudy. Should I ask my psychian can I get a MRI just for a check up????,"YES/NO
There can be tumor in the brain which can cause this problem.To find that out MRI is helpful. 
But the doctor is the best person to decide but no harm in suggesting. 
BEST OF LUCK QUICK RECOVERY.",There can be tumor in the brain which can cause this problem.,Alternative Medicine,Health,Alternative Medicine,,,,cause
What are methods to stop self harm?,"I've tried the elastic band and red marker but they don't work, and I've tried ice, but I like to eat ice. ^^'

Is self harm that bad, I just cut my arms, wrists, fingers and belly...","Do something to help someone in need. If you focus on someone else's problems, you'll forget your own! Volunteer at a soup kitchen or rescue mission. You will see some people with actual survival needs. Your problems will diminish, you will have a great sense of fulfillment and you won't have time to hurt yourself.","Your problems will diminish, you will have a great sense of fulfillment and you won't have time to hurt yourself.",First Aid,Health,General Health Care,,,,information
why is my do i keep on shaking after drinking coffee?  Is is coffee bad for the heart? i never had it before.?,,because there is soo much caffine in it and your body isnt ready 4 all that caffine!!,because there is soo much caffine in it and your body isnt ready 4 all that caffine!,First Aid,Health,General Health Care,,,,cause
Where can I find a place on the web to look up a pill?,Can I look up the name of a pill and find what it's used for? I want a website please.,"If the pill is a brand name,you can type in the name of the pill into your search engine and it will fine the manufacturer.If it is generic you can still do this,but you might type in Web MD it can tell you the pill name","If it is generic you can still do this, but you might type in Web MD it can tell you the pill name",Alternative Medicine,Health,Alternative Medicine,,,,information
Any one taking crestor?,"My Dr recently prescribed Crestor.  I was wondering if anyone has any experience(s) they would like to share (good or bad) or recommendations, opinions.",Good medicine if you need it.  Try watching your fat intake.  Always see a doctor after you start to monitor for side effects.,Always see a doctor after you start to monitor for side effects.,Heart Diseases,Health,Diseases & Conditions,,,,suggestion
Taking the Pill How Long Should I Wait to Have Sex?,So I started taking the pill on the 29th of October.  I'm now on the sugar pills this week it should end Saturday so I start taking the active pills on Sunday so I only have to wait a month after I take them to start having sex without a condom right.  I know it's safer with one but I only have to wait a month right? So would I still have to use a condom Saturday since it's my last sugar pill and then I don't have to use one Sunday b/c I'm starting the active pill again.  Or can I not use a condom on Saturday b/c I'm starting the active pill on Sunday again? Thanks,"If I were you I would take extra precautions for a full month after starting, just to be sure...;","If I were you I would take extra precautions for a full month after starting, just to be sure...;",Women's Health,Health,Women's Health,,,,suggestion
What will happen if someone gives oral sex to a person infected with crabs?,"I know that when an individual's genitals are infected with crabs, the parasites feed on the skin.  If a person's  mouth is infected with the disease, do the same results occur? Can  someone's mouth even get infected by the disease?",you can only catch crabs by sex. and it isnt a .sts. go get nix. shampoo at your local pharmacy. and put it on every place where hair is .redo this in.7. days it is like headlice. and yjis person is in my opion not clean. crabs are pastisites they live where hair is in all places ?,redo this in.7.,STDs,Health,Diseases & Conditions,,,,treatment
There's a blood drive happening at my school...am I allowed to give blood?,"I'm old enough to give blood, but I take birth control pills, Adderall (for ADHD), and Celexa (for depression). Will the blood drive people reject me when I go to give blood because I take those medications?",Call red cross blood donation centers and ask if these medication would disqualify you from donating.  Also you must weigh at least 110 lbs!,Also you must weigh at least 110 lbs!,Other - Health,Health,Other - Health,,,,information
Drink water but still dehydrated?,"I drink water, maybe not 64 ounces a day, but a decent amount...but I tend to urinate most of it out.  Hence I'm still somewhat mildly dehydrated...what does that mean?  Or do I need to just keep drinking water?",I have the same problem! Email me the answer please.,Email me the answer please.,First Aid,Health,General Health Care,,,,information
crisco for lips?,my lips are very dry. the skin is brittle. even blistics wont work. should i use a heavier method like crisco in the can? I tried some honey but it just made my lips shiny and sweet. my man wont kiss me cause he doesn't want me to slice his face.,Crisco ain't for no kissin' if ya's gonna use it make interestin'.,Crisco ain't for no kissin' if ya's gonna use it make interestin'.,Other - Health,Health,Other - Health,,,,information
